nombre;nif;email;telefono;direccion;provincia
MURO LEON, S.L.;;construcciones@muroleon.com;000836005;LARGA, S/N, 02109;CADREITA, ESPAÑA
MURO SUMINISTROS Y SERVICIOS, S.L.U;;;000750123;PASEO DEL MALACATE, 40, 01320;LA PUEBLA DE MONTALBAN, ESPAÑA
MUSTAFA AL ASALI;;;000000000;HORTALEZ, 29, 02751;MADRID, ESPAÑA
MUTUAL MATERIALS COMPANY;;ap@mutualmaterials.com;(425)452-2300;7414 S 206th ST, 03009;KENT, EE.UU.
N.U.C., S.A.;;;91-5425147;PRINCESA, 2  4 PL. PTA. 3, 00557;MADRID, ESPAÑA
NAGOIKO, S.L.;;;000696486;MAGDALENA AULINA, 4 BAJO, 01791;SAN ADRIAN, ESPAÑA
NARCISO GUADALIX CTNES., S.A.;;;91-6526379;AVDA. DE LA INDUSTRIA, 53  OFC. 8, 00554;ALCOBENDAS, ESPAÑA
NARCISO JURADO BERNAL;;;956-371672;VIRGEN DE PALOMARES, 15, 00282;CHIPIONA, ESPAÑA
NARVAL EMP.GRAL DE CONST., S.A.;;;91-4009910;SAMARIA, 3, 00797;MADRID, ESPAÑA
NASIPA, S.L.;;nerea@nasipa.com;943425100;REMIGIO MUGICA, 2BJ, 01964;PAMPLONA, ESPAÑA
NASTAS SER, S.L.;;;000000000;BILBAO, 34, 02132;EL ESCORIAL, ESPAÑA
NATALIA NEVADO SANZ;;;000000000;VALLADOLID, 02137;LA LASTRILLA, ESPAÑA
NAVES INDUSTRIALES YELES, S.L.;;;000000000;BARRIO DEL PILR, 1, 00863;YELES, ESPAÑA
NAVES Y PARQUES INDUST., S.A.;;napisa@napisa.com;005060361;ALCALDE ANGEL ARROYO, 00524;GETAFE, ESPAÑA
NEFRET, S.L.;;;002354282;ORENSE, 00952;MADRID, ESPAÑA
NEGOCIO DE BIENES PATRIMONIALES, S.L.;;;008984873;UMBRIA, 3, 01881;VALDEMAQUEDA, ESPAÑA
NELSON JOSE JARDIN AUAD;;;000000000;AV. MEJICO - CHALET 661-E, 02126;EL ESPINAR, ESPAÑA
NEXT PEREDA INMOBILIARIA, S.A.;;;007090000;DE LAS DOS CASTILLAS, 33, ATICO 6, 3ª PTA., 01685;POZUELO DE ALARCON, ESPAÑA
NEXWAY SAS;;;000000000;1 AVENUE DU GENÉRAL DE GAULLE, TOUR PB, 02425;PARIS LA DÈFENSE CEDEX, FRANCIA
NEYBE MAT. DE CONST. T MADERA, S. L.;;;281804--MIGUEL;CTRA. DE SANTANDER, 71, 00464;VILLAOBISPO DE LAS REGUERAS, ESPAÑA
NICOLAE POP;;;000000000;FERROCARRIL, 4    1ºA, 02057;ILLESCAS, ESPAÑA
NICOLAS BEJARANO FERNANDEZ;;;918540155;CTRA. DE EL ESCORIAL, KM. 11.500, 00669;GUADARRAMA, ESPAÑA
NICULAE ILIE;;;000000000;ELISA, 7, 3º CENTRO, 02539;MADRID, ESPAÑA
NIEDRU JUMTI, SIA;;info@jumti.lv;007520399;LIZUMA IELA, 5J, 02136;RIGA, LETONIA
NISTAL MAROÑAS, S.A.;;;008455713;ALTO DE LA CAMORCHA, 12, 02695;COLMENAR VIEJO, ESPAÑA
NOCITAM, S.L.;;;000000000;DE CAN CARRERO, 01569;LES FRANQUESES DEL VALLES, ESPAÑA
NOEMI CONDE RONTOME;;;000000000;GRAN VIA DE HORTALEZA, 5, PORTAL D, 02106;MADRID, ESPAÑA
NON DESIGN SERVICES LLC;;saif@wearenon.com;000000000;FLAGSHIP OFFICE G20, 03092;AL SAFEENA, DUBAI
NORDEN, S.A.;;;003198821;FORTUNY, 51, 02700;MADRID, ESPAÑA
NORGYPSUM BILAZU, S.L.;;info@bilazu.com//vanessa@norgabe.com;004411391;POL LINTZIRIN, 12, 02486;OIARTZUN, ESPAÑA
NORTH RIM IBERICA, S.L.;;;006323158;FORJADORES, 17**P. I. PRADO ESPINO, 01011;BOADILLA DEL MONTE, ESPAÑA
NORTHERN INDUSTRIAL ELECTRONICS, LTD;;;000000000;THWAITES ROAD   BLACKBURN, 02475;LANCASHIRE, REINO UNIDO
NOVA INDOMUS, S.L.U;;;006581741;CONSTITUCION, 93  2º A, 02504;ALCOBENDAS, ESPAÑA
NOVA JOAMI S.L.;;novajoami@gmail.com;;CARRER DEL PROFESOR IDILIO GIMENO, 4, 03073;TORRENT, ESPAÑA
NOVAMAT POLVORANCA, S.L.;;novamatpolvoranca@hotmail.com;006895376;TRIGO, 1  NAVE, 12 P.I. POLVORANCA, 01010;LEGANES, ESPAÑA
NUANCE FRONTIER - UNIPESSOAL LDA;;;000000000;RUA ALBERTO OLIVEIRA, 417, 02540;POVOA DE VARZIM, FRANCIA
NUDIS CERAMICOS, S.L.;;;000000000;HILARIO TOMAS, S/Nº, 02172;HELLIN, ESPAÑA
NUFEMAR COMBUSTIBLE, S.L;;;609101852;MANUEL BENITEZ EL CORDOBES LOCAL 6, 00369;CORDOBA, ESPAÑA
NUICON CONSTRUCCIONES Y PROYECTOS, S.A.;;;000000000;VICENTE ALEIXANDRE. 3, 1ª PLANTA, 02941;LAS ROZAS, ESPAÑA
NUNO TEIXEIRA;;;000000000; MIGUEL BOMBARDA, 510 ENT. A  2ºDR  FRT, 02809;ERMESINDE, PORTUGAL
NUSA-DUA, S.L.;;;925506414;CUESTA BLANCA, S/N, 01273;NOBLEJAS, ESPAÑA
NVE ENGENHARIAS, S.A.;;faturas@nve.pt;000000000;DOCTOR JOSE SAMPAIO, 632, 02470;GUIMARES, PORTUGAL
NYMAR LIVE, S.L.;;jose@nymar.es;000000000;CUARTA AVENIDA, 6, 02836;TORREJON DE LA CALZA, ESPAÑA
NYMAR WOOD, S.L.;;administracion@nymar.es;000000000;CUARTA AVENIDA, 6, 02975;TORREJON DE LA CALZA, ESPAÑA
O. C. CONSTRUCCIONES RODISA, S.L.;;;000000000;PONTEDEUME, 10, 02505;MADRID, ESPAÑA
O. S. Y. NUEVA EUROPA, S.L.;;;000000000;PINTO, 41, 00837;PARLA, ESPAÑA
OBRAMAR DEL MEDITERRANEO, S.L.;;;005142159;AVDA. MAISONNVE, 3 **  7ª, 00071;ALICANTE, ESPAÑA
OBRAS COMAN, S.A.;;rjalvarez@obrascoman.es;000203355;TRAFALGAR, 20, PARC. 75, 01737;GUADALAJARA, ESPAÑA
OBRAS CONTINENTAL DE COMERCIO, S.L.;;;000000000;PETROLEO, 9, 00906;MADRID, ESPAÑA
OBRAS ESPECIALES EDIF. E INFRAESTRUCT., S.A.U.;;luis.arraras@obrasespeciales.com;902110462;REMIRO DE GOÑI, 16 BAJO, 02281;PAMPLONA, ESPAÑA
OBRAS ESPECIALES GUIPUZCOA, S.A.;;obegisa@obrasespeciales.com;000210536;POKOPANDEGI BIDES,11, 2ª PTA.OF.203-208, 01993;DONOSTIA-SAN SEBASTIAN, ESPAÑA
OBRAS ESTRUCTURAS Y REFORMAS, S.L.;;eugenia@belucha.com;005943090;DE LA CONSTITUCIÓN, 7, 01691;SAN JUAN, ESPAÑA
OBRAS GENERALES DEL NORTE, S.A.;;compras@ogensa.com;005118011;FRAY CEFERINO, 25, 1º, 02019;OVIEDO, ESPAÑA
OBRAS LO MAS BONITO, S.L.;;maiteruiz@grupolmb.com;000145012;PLAZA MAESTRO ARROYO, 2 -BAJO, 02722;CALAHORRA, ESPAÑA
OBRAS RURALES Y ALBAÑILERIA, S.L.;;;006896349;DIAMANTE, 41, 02001;HUMANES DE MADRID, ESPAÑA
OBRAS SOBRINO CORTEGUERA, S.L.;;;;LOS ARCES, 20, 00427;FONTANAR, ESPAÑA
OBRAS VIMAN, S.L.;;;000000000;GAVILANES, 4, 02436;VILLARRUBIA DE LOS OJOS, ESPAÑA
OBRAS Y CONSTRUCCIONES ALIENDRE, S.L.;;;000000000;AVDA. DE NAVALCARNERO, 28, 01764;GRIÑON, ESPAÑA
OBRAS Y CONSTRUCCIONES DE LA MEJANA, S.L.;;;000818829;CUESTA TEJERIAS, S/N, 02134;MURCHANTE, ESPAÑA
OBRAS Y CONTRATAS CASTAÑO S.L.;;jcalvarez@construcast2000.com;000000000;ILLES MEDES, Nº 9 NAVE 4, 02796;SANT QUIRZE DEL VALLES, ESPAÑA
OBRAS Y CONTRATAS LA SAGRA, S.L.;;freyven2001@hotmail.com;000000000;RUFINO RUBIO, 14, 02350;YELES, ESPAÑA
OBRAS Y CTNES. PIMAR, S.L.;;;954-564103;PLAZA DEL DUQUE, 1  4¬  PLANTA, 00439;SEVILLA, ESPAÑA
OBRAS Y DISEÑOS URBANOS, S.L.;;;000149320;DAOIZ Y VELARDE, 01450;VILLARRUBIA DE SANTIAGO, ESPAÑA
OBRAS Y ESTRUCTURAS SIRVENT HNOS., S.L.;;;005673297;1º DE MAYO, 24 ENTP. A, 00074;SAN VICENTE DEL RASPEIG, ESPAÑA
OBRAS Y GRASS, S.L.;;;000000000;SANTA LUCIA, 15, 03090;MAJADAHONDA, ESPAÑA
OBRAS Y PROYECTOS CERVANTES, S.L.;;;000501147;MAESTRO ECHEVARRIA BRAVO, 1  3ºF, 01559;TOMELLOSO, ESPAÑA
OBRAS Y REF. NUEVO AMBIENTE, S.L.;;;000000000;PRESIDENTE KENNEDY, 8, 00882;MADRID, ESPAÑA
OBRAS Y REFORMAS AMANIEL, S.L.;;;91-5420820;AMANIEL, 29, 00702;MADRID, ESPAÑA
OBRAS Y REFORMAS VILLASUR, S.L.;;villasur@hotmail.com;000000000;RESIDENCIAL LAS VILLAS, PARC. 1.41, 02056;VILLARRUBIA DE LOS OJOS, ESPAÑA
OBRAS Y SERVICIOS DOYAGUE, S.L.;;;001346396;TINTO ENRIQUE, 14-PLTA. 2, 01785;VALDEMORO, ESPAÑA
OBRAS Y SERVICIOS GOMEZ CRESPO, S.L.;;;000510180;ESTRADA CASTADON-SAN MIGUEL CAMPO, 02905;PEREIRO AGUIAR, ESPAÑA
OBRAS Y SERVICIOS MARFIL 97, S.L.;;marfil97sl@gmail.com;916667029;FRESADORA, 5 ** POLG. SANTA ANA, 00754;RIVAS VACIAMADRID, ESPAÑA
OBRAS Y SERVICIOS PUBLICOS, S.A.;;;000000000;MANOTERAS, 30. OFIC. B-219, 02969;MADRID, ESPAÑA
OBRAS ZATO, S.L.;;pzconstruccion@hotmail.com;000000000;GARBÍ, 6-8, 02911;PINEDA DE MAR, ESPAÑA
OBRAS, CAMINOS Y CANALES, S.A.;;arturo@occsa.es;000214551;TESIFONTE GALLEGO, 5  2º  D, 02034;ALBACETE, ESPAÑA
OBRAS, PAVIMENTOS E INST. INDUSTRIALES, S.L.;;administracion@opain.net;;GALAXIA, 28, 02460;MADRID, ESPAÑA
OBRASCON, HUARTE, LAIN, S.A.;;;003484100;DE LA CASTELLANA, 259-D, 00767;MADRID, ESPAÑA
OCA CONSTRUCCIONES Y PROYECTOS, S.A.;;;005206262;POL. IND. DE OLLONIEGO - PARCELA B-8, 01185;OLLONIEGO, ESPAÑA
OCESA OBRAS Y CONSTRUCCIONES, S.L.;;;000546122;DE SAN ESTEBAN, 11 BAJO, 01992;ARANDA DE DUERO, ESPAÑA
OCIDE CONSTRUCCIÓN, S.A.;;;003394220;CLARIANO, 16, ENTRESUELO, 02653;VALENCIA, ESPAÑA
OCTAVIAN LAURENTIU POPA;;;918860263;PUERTA DEL SOL, 12- 3 H, 00949;MECO, ESPAÑA
OFFICIA URBANA, S.L.;;;000000000;COSO, 31 ESC. IZQDA., 02643;ZARAGOZA, ESPAÑA
OFFICINE SMAC, S.P.A.;;;006830089;SACCO E VANZETTI, 13 - 15, 02943;FIORANO MODENESE, ITALIA
OHICOL ESPAÑOLA, S.L;;;657860608;SANTO TOMAS DE AQUINO, 22, 00862;PARLA, ESPAÑA
OHM-DISTRI - SAS;;info@ohm-easy.com;020044896;3 RUE DU DOCTEUR HUART, 02426;HELLEMMES LILLE, FRANCIA
OINSA, S.L.;;;000602525;REYES LEONESES, 23 BAJO, 01532;LEON, ESPAÑA
ÖKK - KLINKER GMBH;;verkauf@klinker.cc;07735-6571;UNTERSELING, 11, 02554;BACHMANNING, AUSTRIA
OLIVARES GARRIGOS, S.L.;;jdelaguia@oligarry.es;000563017;COMUNIDAD DE MURCIA,1 P.I. POZO HONDO, 01973;CAMPO DE CRIPTANA, ESPAÑA
OLIVARES MAT.DE CONST., S.L.;;;000165549;DON QUIJOTE, 4, 00385;EL PROVENCIO, ESPAÑA
OLIVERAS DERIVATS I MATERIALS, S.L.;;oliverasquart@gmail.com;000000000;COMARCAL C-250, KM. 4,3, 02586;PALOL D'ONYAR-QUART, ESPAÑA
OM CONSULTANTS;;omcons@gmail.com;026287817;13,COMMUNITY CENTRE,EAST OF KAILASH,2, 02347;NEW DELHI, INDIA
ONE HOSTEL ARAGO, S.L.;;albertvall@casa.info;004265752;FLORIDABLANCA, 144, ENTL., 02329;BARCELONA, ESPAÑA
ONERGYS GMBH;;;031121580;NORDWALL, 02599;GELDEM, ALEMANIA
ONSAZE INFRAESTRUCTURAS, S.L.;;;000880209;MORALZARZAL, 12. PARQ. EMP. EL ENCINAR, 02692;ALCORCON, ESPAÑA
OPACUA, S.A.;;administracion@opacua.es;000283346;DUQUE DE WELLINGTON,8,1ª PLANTA OF.1, 02230;VITORIA, ESPAÑA
OPERIS OBRAS Y MANTENIMIENTO, S.L.;;;000000000;LUGAR DE SAN JOSÉ, 44, 2º, 02785;LA CORUÑA, ESPAÑA
OPORTO E HIJOS, S.L.;;;008178436;TORRIJOS, 38, 01386;MENTRIDA, ESPAÑA
OPROLER OBRAS Y PROYECTOS, S.L.U.;;oproler@oproler.com;000000000;ORENSE, 81  4ª PLANTA, 01869;MADRID, ESPAÑA
ORAMBA EXTREMADURA ESTRUCTURA, S.L.;;jgregorio@oramba.com;000000000;MAUDES, 51, 8º, 02648;MADRID, ESPAÑA
ORBITA PROYECTOS CONSTRUCTIVOS, S.L.;;;000000000;M-40, Nº 9, 1º 18, 02404;ALCORCON, ESPAÑA
ORDENACION Y MEDIOAMBIENTE, S.L.;;ignacio.escribano@telefonica.net;000000000;TAMBRE, 41, 01638;MADRID, ESPAÑA
ORDOSAN, S.L.;;carlos@ordosan.com;004250000;BRAVO MURILLO, 226  1º  IZDA, 00530;MADRID, ESPAÑA
ORECO , S.A.;;oreco@oreco.es;419422/424166;FRAGOSIÑO, 8**SARDOMA, 01551;VIGO, ESPAÑA
OREVISA;;;913508376;COSTA RICA, 14 1º 1, 00480;MADRID, ESPAÑA
ORIA SERV. CONST. E INTERIORISMO, S.L.;;;001032586;AMERICA, 32, 01812;ALCORCON, ESPAÑA
ORMEVA, S.L.;;;918893817;ARALIAS, 1, 00846;GRIÑO, ESPAÑA
ORO REFORMAS, S.L.;;;696603223;CRISTO DE LA SALUD, 6  2º, 00920;VALDEMORO, ESPAÑA
OROMANA PROY. INMOBILIARIOS, S.L.;;;000000000;CERVANTES, 01390;NAMBROCA, ESPAÑA
ORTHEM SERVICIOS Y ACT. AMBIENTALES, S.A.U.;;;000350034;JUAN CARLOS I, 43 - PLANTA 2º, 02607;MURCIA, ESPAÑA
ORTIZ CONSTRUCCIONES Y PROYECTOS, S.A.;;contabilidad@grupoortiz.com;003431600;DEL ENSANCHE DE VALLECAS, 01092;MADRID, ESPAÑA
OSCAMATEN, S.L.;;oscamaten@hotmail.com;000000000;LILLO JUAN, 63 BAJO IZQDA., 02819;SAN VICENTE DEL RASP, ESPAÑA
OSCAR MARTIN RUEDA;;;000000000;SEMINARIO, 26  3ºA, 00924;LEGANES, ESPAÑA
OSCAR RUIZ FERNANDEZ;;;000000000;LA HOYA, 39, 02236;YUNCOS, ESPAÑA
OSTARBI ERAIKUNTZA ETA ZERBITZUAK, S.L.;;info@ostarbi.com;000692014;KALE BERRIA, 17, BAJO B, 02190;VILLABONA, ESPAÑA
OTA CONTRATAS, S.L.;;otacontratas@gmail;000000000;HERMANOS FERNANDEZ CRIADO, 15, 02573;ILLESCAS, ESPAÑA
OTEGAR PROMOCIONES Y OBRAS, S.L.;;otegar.obras@yahoo.com;000558024;RIO, 22, 01936;LOMINCHAR, ESPAÑA
P. J. F. TOLEDO 2014, S.L.;;;000000000;OSLO, 6, 02361;TOLEDO, ESPAÑA
P.C. JUFEMA;;;000000000;MADRID, 28, 00760;COLMENAREJO, ESPAÑA
P.H.A.S.A. CIA. GENERAL DE CTNES., S.L.;;;000206556;POSADA HERRERA, 3   4º  A, 01592;OVIEDO, ESPAÑA
P.J.F. TOLEDO 2014, S.L.;;;000000000;OSLO, 02900;TOLEDO, ESPAÑA
PABLO DOMINGUEZ GONZALEZ;;;000320687;MARCOS ANIANO, 60, 00376;TARANCON, ESPAÑA
PABLO EUGENIO ALONSO ORTEGA;;;91-8120581;PASEO DEL OLIVAR, 19, 00808;EL ALAMO, ESPAÑA
PABLO MEDINA HUERTAS;;;000000000;ALMAGRO, 104, 02868;BOLAÑOS DE CALATRAVA, ESPAÑA
PABLO SIERRA AGUERO;;;916643221;AVDA. OLIMPICA, 20  6º, 00782;MOSTOLES, ESPAÑA
PACKDALE GROUP LLC;;;003573296;PUSKINI, 12 - 13, 01847;NARVA, ESTONIA
PACO MORENO SOLUCIONES, S.L.;;;679489375;FEDERICO COULLAUT VALERA, 12, 00042;HELLIN, ESPAÑA
PACO RUFINO, S.L.;;pacorufino@hotmail.es;000310350;SANTA ADELA, 11   2º, 02179;MONTEFRIO, ESPAÑA
PACO Y PAULA, S.L.;;;967-495199;CTRA. TARAZONA KM. 42,500, 00394;QUINTANAR DEL REY, ESPAÑA
PADI SERVICIOS Y SUMINISTROS, S.L.;;;967321421;CTRA. DE ALMANSA, 19, 00026;FUENTEALAMO, ESPAÑA
PALAU E HIJOS, S.L.;;palauehijos@gmail.com;001200474;AVDA. ALBUDOR, 13, 02597;SILLA, ESPAÑA
PALETS BENAVIDES, S.L.;;;000370103;EL CEMENTERIO, S/N, 02405;BENAVIDES DE ORBIGO, ESPAÑA
PAMACON, M.C., S.L.;;;000000000;CTRA. ALCAZAR KM.2,800, 00375;CUENCA, ESPAÑA
PANDORA GESTION DE ACTIVOS, S.L.;;;000000000;PORTA DE LA MAR, 5, PTA. 6, 03094;VALENCIA, ESPAÑA
PARDO MAT. DE CONSTRUCCION, S.L.;;;967475319;DEPORTES, 8, 00035;CASAS DE VES, ESPAÑA
PARIS  NEGOCE, Sarl;;;000712714;RUE MOHAMED YA ZID LOD AVIATION, 418, 01494;TETOUAN, MARRUECOS
PARK CONSTRUCTION ALBANIA SHPK;;info@parkconstruction-al.com;684074303;RRUGA E KAVAJËS, 110, 02980;TIRANA, ALBANIA
PARQUE EL PINAR, S.L.;;;000545055;CTRA. DE SERRANILLOS, KM. 13,400, 01312;YELES, ESPAÑA
PARQUE NORTE INFRAESTRUCTURAS, S.L.;;;000000000;ALFONSO XI, 18 - 5A, 02993;BURGOS, ESPAÑA
PARROQUIA DE SANTA MARIA DE ILLESCAS;;;000511223;PZ. HNOS. FERNANDEZ CRIADO, 14, 01383;ILLESCAS, ESPAÑA
PASAYMA, S.A.;;;007973078;ARENAS, 01084;MADRID, ESPAÑA
PATIO REAL, S.L.;;;;PIEDAD COLON, 2, 01359;BOROX, ESPAÑA
PAUL GEANTA;;;000000000;OCEANO ATLANTICO, 4 - P3-PTA. A-ESC. D, 02149;COSLADA, ESPAÑA
PAV. GUADARRAMA, S.L.;;;918548188;AVD. DEL MOLINO DEL REY, 23, 00716;GUADARRAMA, ESPAÑA
PAV. REDONDO PARTE, S.L.;;;000000000;GOYA, 18, 00711;COLLADO VILLALBA, ESPAÑA
PAV. Y REV. DEL ALAMO, S.L.;;;91-7970841;VALLE TOBALINA, 60, 00549;MADRID, ESPAÑA
PAVIMENTO Y AZULEJOS PARLA, S.L.;;;000000000;CAVANILLES, 40 LOCAL, 02763;MADRID, ESPAÑA
PAVIMENTOS 2 M.R., S.L.;;;916668079;CTRA. DE VALENCIA, KM. 14,800, 00744;MADRID, ESPAÑA
PAVIMENTOS BERMEJO, S.L;;;003668363;MEDIODIA CHICA, 01026;MADRID, ESPAÑA
PAVIMENTOS ELCHE LOGISTIC, S.L.;;pavimentoselche@pavimentoselche.com;005421928;PARTIDA JUBALCOY, 1  -  140, 01587;ELCHE, ESPAÑA
PAVIMENTOS IND. BOROX, S.L.;;;000000000;CUENCA,19, 02296;BOROX, ESPAÑA
PAVIMENTOS Y REVESTIMIENTOS HNOS. PAMPLONA, S.L.;;admonhpamplona@bigmat.es;000730247;SAGUNTO-BURGOS, KM. 190, 02494;CALAMOCHA, ESPAÑA
PAVIMENTOS,AZULEJOS Y MARMOLES PRIETO, S.L.;;azulejosprieto@hotmail.com;006581741;CTRA. N- III KM. 54,00- NAVE C- POLIG. IGARSA, 00859;PARACUELLOS DEL JARAMA, ESPAÑA
PAVIREMA, S.L.;;;980695028;CTRA. DE POZO ANTIGUO, KM. 0,500, 01491;TORO, ESPAÑA
PECO E HIJOS, S.L.;;;008715881;REAL, 120, 00874;ARGANDA DEL REY, ESPAÑA
PEDRO ALFONSO VIDAL, S.L.;;;968556192;AVDA. SAN GERONIMO, 20, 01132;POZO ESTRECHO* CARTAGENA, ESPAÑA
PEDRO ANTONIO GARCIA ARROYO;;;969294417;AMARGURA, 6, 00403;SAN LORENZO DE LA PARRILLA, ESPAÑA
PEDRO ANTONIO PALOMO MATA;;;000369125;TRAVESÍA CANTERAS, 10, 01581;CARRIZOSA, ESPAÑA
PEDRO BARBERO, S.L.;;contabilidad@novacasaceramica.es;000380014;REYES CATOLICOS, 39, 01460;SONSECA, ESPAÑA
PEDRO BARRANQUERO GOMEZ;;;000000000;LIBERTAD, 01702;SIRUELA, ESPAÑA
PEDRO CALVO GARRIDO;;;91-4655378;SAN VICTORINO, 11, 00577;MADRID, ESPAÑA
PEDRO DANIEL MORAGON LANDROVE;;;91-7782095;AV. PABLO NERUDA, 3, 00550;MADRID, ESPAÑA
PEDRO GARCIA GARCIA;;matcons.pgarcia@hotmail.com;000000000;PRINCESA DE GALES, 11, 02919;COLMENAR DE OREJA, ESPAÑA
PEDRO GARCIA GONZALEZ;;;008944785;CASAS QUEMADAS, 01032;COLMENAR DE OREJA, ESPAÑA
PEDRO GOMEZ GARCIA;;;917774387;AVD. PABLO NERUDA, 120, PORTAL C, 3 IZD., 00516;MADRID, ESPAÑA
PEDRO GRANADO DIAZ;;;000375421;PRINCIPE ASTURIAS, S/N, 01715;VILLAHERMOSA, ESPAÑA
PEDRO IZQUIERDO. S.L.;;;916322707;PEDRO DE REPIDE, 22, 00610;MADRID, ESPAÑA
PEDRO SERRANO PEINADO;;;000000000;MESONES, 20, 02903;POZORRUBIO, ESPAÑA
PEGEM CTNES. Y PROM. S.L.;;;925508282;CONDE DE CEDILLO, 46, 01340;CEDILLO DEL CONDADO, ESPAÑA
PEGEM INST. Y PROM., S.L.;;;000508282;CONDE DE CEDILLO, 01402;CEDILLO DEL CONDADO, ESPAÑA
PEJOCA, S.A.;;;918572343;ERAS DE ARRIBA, 32, 00658;ALPEDRETE, ESPAÑA
PENTAVIAS SDAD. CTRA., S.L.;;;916342854;SANTIAGO APOSTOL, 3, 00664;MAJADAHONDA, ESPAÑA
PEÑA CATALÁN, S.A.;;;004710005;OPORTO, 01020;MADRID, ESPAÑA
PERAGAR, S.L.;;;000180830;VILLAMAYOR 61, 01446;QUINTANAR DE LA ORDEN, ESPAÑA
PERE ESTEVE ROCA, S.C.P.;;info@pereesteve.com;008439287;AVINGUDA DE MONTSERRAT, 4, 01623;LLIÇA DE VALL, ESPAÑA
PEREZ ALEGRE, S.L.;;;927572549;PLAZA MARTIRES, 25, 00247;ALDEANUEVA DE LA VERA, ESPAÑA
PERGAR ESTRUCTURAS, S.L.;;;000000000;CALLEJON DEL NORTE, 5, 02831;PALOMEQUE, ESPAÑA
PERMATINT LTD.;;;000000000;BRADWICK DRIVE UNIT 2, 02604;L4K 1K8 ONTARIO, CANADA
PERONA Y BENITO, S.A.;;;000510435;ESTACION, 00352;TOMELLOSO, ESPAÑA
PERSOBRAS NOCAHIMO, S.L.;;amasa@tolmen.com;007514561;INSULA MALINDRANIA,6-PLANTA PTA. 3, 01907;GETAFE, ESPAÑA
PEYBER HISPANICA, S.L.;;compras@peyber.es;001023800;ALCALA, 01070;MADRID, ESPAÑA
PGH BRICKS & PAVERS P/L;;ap@csr.com.au;083008204;LOCKED BAG 2050-NORT RYDE BC, 02433;SYDNEY NSW, AUSTRALIA
PIANORTE OBRAS Y SERVICIOS, S.L.U.;;oficinatecnica@pianorte.es;003713500;MENENDEZ PELAYO, 83, 02386;MADRID, ESPAÑA
PICADAS 2, S.L;;sdominguez@picadas.es;008650259;PLACITUELA DEL CUARTEL, 10, LOCAL 7 Y 8, 02327;NAVAS DEL REY, ESPAÑA
PIMAR, C.B.;;;000000000;ALHAMBRA, 6, 01354;ILLESCAS, ESPAÑA
PINO MATERIALES CONST. S.L.;;;000761089;EXTREMADURA, 8, 01950;CASTUERA, ESPAÑA
PINUS, S.A.;;carlos.lopez@pinus.es;003560118;MATA DE BURGOS, 8 P.I. DE LOS POZUELOS, 03069;ALCAUDETE, ESPAÑA
PISCINAS CLORAGUA, C.B.;;;916095560;POTRO, 7, 00687;ARROYOMOLINOS, ESPAÑA
PISCINAS ESCORIAL, S.L.;;;000000000;DALIAS, 11, 01967;BRUNETE, ESPAÑA
PLANA HORTONEDA, S.L.;;construccions.plana@gmail.com;000391420;SANT PERE, 10, 02268;VILASECA, ESPAÑA
POBLACONS EXCLUSIVO, S.L.;;tecnico2@grupopoblador.com;000384275;NAPOLES, 1, PLANTA BAJA, 02663;CACERES, ESPAÑA
POCHICHE, S.A.;;;968610257;POL. IND. EL TAPIADO, 01136;MOLINA DE SEGURA, ESPAÑA
POLIGONO INDUSTRIAL EL BRIZO FASE II, S.A.;;elbrizo2@yahoo.es;000298173;ENCINA, PARC. 7 - NAVE 2, 02104;ALDEAMAYOR DE SAN MARTIN, ESPAÑA
POLSANDO, S.L.;;clientes@polsando.com;005724193;MAIRENA, S/N, 01838;BORMUJOS, ESPAÑA
POLVERO LA CARCEL, S.L.;;p.salguero@polverolacarcel.es;000000000;VIDAL DE NOYA, 4, 02155;SEVILLA, ESPAÑA
POLVERO NUEVO, S.L.;;;005953560;CTRA. DE TORREPALMA. KM. 1,000, 01836;CARMONA, ESPAÑA
POLVERO PACHON, S.L.;;epachon@polveropachon.com;004409353;IND. SAN NICOLAS, C/10, NAVE 4, 02286;ALCALA DE GUADAIRA, ESPAÑA
POMPEYO AGURTO MORENO;;;000000000;FERNANDO TRUEBA, 2, 02205;ILLESCAS, ESPAÑA
PONFRASA, S.L.;;;924-257305;CTRA. DE SEVILLA KM. 2,5, 00114;BADAJOZ, ESPAÑA
PONTES Y DELGADO, S.L.;;;918130027;GENENRAL ASENSIO, 17, 00746;SEVILLA LA NUEVA, ESPAÑA
PORCENAT, S.L.;;porcenat@hormiexsa.com;000812813;POL. IND. ISAAC PERAL - PLA. B-2, 00185;DON BENITO, ESPAÑA
PORSEMAT COMERCIAL, S.L.;;elena.sumco@gmail.com / compras.sumco@g;008933066;SEGARRA, 7-15, 02856;LES ROQUETES (SANT PERE DE RIBES), ESPAÑA
PORTAL DE LA SAGRA, S.L.;;brickstone_ly@yahoo.es;000531871;GRECO, 16, 01958;YUNCLER, ESPAÑA
PORTERO AZULEJOS, S.L.;;;000207272;CTRA. SEVILLA, Nº 99**KM., 00179;BADAJOZ, ESPAÑA
PORTERO ESCOBAR DISTRIB., S.L.;;;924-207280;APD. CORREOS 30080- CTRA. N-V KM. 397, 00160;BADAJOZ, ESPAÑA
PORTERO ESCOBAR EXPOS., S.L.;;;000207272;CTRA. N-V KM. 397, 00116;BADAJOZ, ESPAÑA
PRADO ESTUDIOS Y PROMOCIONES, S.L.;;;000000000;ENRIQUE TROMPETA, 4 - 4ºB, 02238;MADRID, ESPAÑA
PRASI, S.A.;;prasi@prasi.com;004744809;LAUREL, 21  1º, 00951;MADRID, ESPAÑA
PREFABRICADOS DE HORMIGON QUILEZ, C.L.;;;000435057;CTRA. COMARCAL 412, KM. 0,200, 00020;RIOPAR, ESPAÑA
PREFABRICADOS MANZANO, S.L.;;;927217310;POL. IND. CHARCA MUSIA, S/N, 00229;CACERES, ESPAÑA
PREFABRICADOS SANTA EULALIA, S.L.;;;968424816;PABLO PICASSO, 13, 01168;TOTANA, ESPAÑA
PREFABRICADOS TARAZONA, C.B.;;;967-480036;SENDA DE LOS CLERIGOS, S/Nº, 00022;TARAZONA DE LA MANCHA, ESPAÑA
PREFABRICADOS Y HORMIGONES DE LA CRUZ, S.L.;;;924530017;CTRA. VILLAFRANCA, 90, 00154;FUENTE DEL MAESTRE, ESPAÑA
PREFABRICADOS Y SANEAMIENTOS, S.L;;;923460521;CTRA. DE SALAMANCA, 01196;CIUDAD RODRIGO, ESPAÑA
PREFABRICATS LLEIDA, S.L.;;alfredo@prefabricatslleida.com;000400179;D'AGRAMUNT, KM. 0,5, 01966;ARTESA DE SEGRE, ESPAÑA
PREMATRANS, S.C.L.;;;968730350;CTRA. DE CARAVACA, KM. 12,100, 01173;MORATALLA, ESPAÑA
PREMIUM NDERTIM;;info@premium-ship.com;355696090007;Rruga Dubai, Nr Pasurie 89/68, 03049;ZONA KADASTRALE, ALBANIA
PRENSAGRA, S.L.;;;000557404;CM-404, KM. 28, 02006;NUMANCIA DE LA SAGRA, ESPAÑA
PRETENSADOS SANCHEZ, S.L.;;;924-448040;CTRA. MADRID-LISBOA KM. 3, 00132;VILLAFRANCO DEL GUADIANA, ESPAÑA
PRETENSATS CUÑAT, S.L.;;jordi@cunyat.com;390 115;DE LA CAPELLA, 02124;AGRAMUNT, ESPAÑA
PRETOBE, S.A.;;ferreteria@pretobe.com;000000000;CAMI CAPUTXINS, S/N, 02247;ONTENIENTE, ESPAÑA
PRIDECA, S.L.L.;;jjdelcastillo@hotmail.com;000311106;LA CAVA, 1, 01872;PRIEGO, ESPAÑA
PRIETO PALACIO, S.L.;;;000796331;HORTELANOS, 4, 01642;TORDESILLAS, ESPAÑA
PRIMERA LLC;;primera.fs2018@gmail.com;003578298;SMEKANIEH SHOUF, 02674;BEYROUTH, LIBANO
PROACON, S.A.;;;954272221;AVDA. REP. ARGENTINA, 25  8º, 01218;SEVILLA, ESPAÑA
PROALBA, S.L.;;;000000000;PASAJE D'SCALS, 3 BAJO, 02670;IBI, ESPAÑA
PROCASA GRUPO JUANPA, S.L.;;;000000000;SANTA RITA, 46 BAJO, 02634;IBI, ESPAÑA
PROCEMUR, S.L.;;juan@procemur.com;000351378;CTRA. DE ALCANTARILLA, 346, 01122;LA RAYA, ESPAÑA
PROCERAN, S.A.U.;;proceran@proceran.es;000688888;CTRA. MONTORO-PUENTE GENIL, KM. 85, 02242;AGUILAR DE LA FRONTE, ESPAÑA
PROCESO INTEGRAL DE EDIFICACION, S.L.;;;004286052;ZARAGOZA, 31  1º DCHA., 02113;SEVILLA, ESPAÑA
PROCYON PLANOS Y OBRAS, S.L.;;;000000000;DOÑA JIMENA, 5, 03038;NAVALCARNERO, ESPAÑA
PRODUCTOS CERAMICOS MORA, S.L.;;;000511286;CTRA. MADRID-TOLEDO, KM. 38,400, 01655;ILLESCAS, ESPAÑA
PROFORMA EJECUCION DE OBRAS Y RESTAURACIONES, S.L.;;;007950446;CAMINO VIEJO DE GETAFE, 39, 02627;FUENLABRADA, ESPAÑA
PROGAEX, S.L.;;;927665008;HERNAN CORTES, 36, 00211;JARAIZ DE LA VERA, ESPAÑA
PROIMASA INVERSIONES INDUSTRIALES, S.L.;;;008141513;CUBA, 7  P.I. LAS NACIONES, 01114;GRIÑON, ESPAÑA
PROINAGRI, S.L.;;;000000000;RECTOR JOSE LUIS LOUSTAU, 8, 1º B, 03056;MURCIA, ESPAÑA
PROINARAZAR, S.L.;;;000000000;MARIA ZAMBRANO, 31-TORRE OESTE PL-15, 02002;ZARAGOZA, ESPAÑA
PROINBECOL, S.L.;;;000000000;PUENTE DEL GRAJAL, 7, 02898;COLMENAR VIEJO, ESPAÑA
PROM. APARCAMIENTOS, S.A.;;proapsa@proapsa.com;006944412;VELASCO CON VUELTA PZA. TOVARES, 01662;LEGANES, ESPAÑA
PROM. ARRIBAS OLMO, SL.;;juani@promocionesarribasolmo.com;000505979;PLAZA DE ESPAÑA, 7, 01873;TOMELLOSO, ESPAÑA
PROM. BOMONTE, S.A.;;;916333511;PLAZA DE LA CRUZ, 5 - 1º, 00566;BOADILLA DEL MONTE, ESPAÑA
PROM. CONDE SAIFE, S.L.;;;000540769;AVDA. CASTILLA LA MANCHA, 87  1º, 01256;ILLESCAS, ESPAÑA
PROM. EDIF. Y CONTRATAS, S.A.;;;004313820;MANUEL TOVAR, 00542;MADRID, ESPAÑA
PROM. EXCLUSIVAS PARRAS PEREZ,S.L.;;;91-8612508;CTRA. AVILA, 17, 00815;SAN MARTIN DE VALDEIGLESIAS, ESPAÑA
PROM. GUADALQUIVIR, S.A.;;;952824712;ARTURO RUBINSTEIN, 7, 01117;MARBELLA, ESPAÑA
PROM. IND. NAVES DE MADRID, S.A.;;;918141513;CUBAS, 3 - POL. IND. LAS NACIONES, 00604;GRIÑO, ESPAÑA
PROM. INM. GRECOMIR, S.L.;;;925540181;GRECO, 11, 00776;ILLESCAS, ESPAÑA
PROM. INM. SALINAS, S.A.;;;916097565;POLVORANCA, 18, 00515;MADRID, ESPAÑA
PROM. PEREZ, S.L.;;;918159465;MADRID, 43  LOCAL  3, 00640;HUMANES DE MADRID, ESPAÑA
PROM. VI, S.A.;;;915282528;DELICIAS, 7, 00671;MADRID, ESPAÑA
PROM. VIV. SANCHEZ PRIMO, S.A.;;;918710226;AVDA. DEL EJERCITO, 3, 00508;ARGANDA DEL REY, ESPAÑA
PROM. Y CONST. GOMEZ ORS, S.L.;;;008015027;LAS ESTRELLAS, 41 BIS, 00742;CIEMPOZUELOS, ESPAÑA
PROM. Y CONSTRUCCIONES ALONSO E HIJOS, S.A.;;alonsohijos@iservicesmail.com;534-90-57;PORTUGAL, 2-ENTLO., 01767;GIJON, ESPAÑA
PROM. Y CTNES. ATALAYA DEL SUR, S.L.;;;000000000;CAPELLANES, 12   3º, 00883;GETAFE, ESPAÑA
PROM. Y CTNES. HERGAHER, S.L.;;;000511240;LOS MARTIRES, 24, 01896;ILLESCAS, ESPAÑA
PROM. Y CTNES. J. SANCHEZ, S.L.;;;916650329;TOLEDO, 27, 00655;GETAFE, ESPAÑA
PROM. Y CTNES. LAUVAR, S.A.;;rayuso@lauvar.com;007261507;PASEO MARQUES DE ZAFRA, 13, 01676;MADRID, ESPAÑA
PROM. Y CTNES. PERGO, S.A.;;;008169730;CAMINO DE CUBAS, S/N, 00854;TORREJON DE LA CALZADA, ESPAÑA
PROM. Y CTNES. RAMOS OCAÑA, C.B.;;;000000000;REAL, 01395;YUNCOS, ESPAÑA
PROM. Y EJECUCIONES J.F., S.L.;;;000507807;VIDAL GARCIA SEVES, LOCAL 4, 01584;YELES, ESPAÑA
PROM. Y GESTION DE VVDAS EN MEJORADA MARSARI, S.L.;;;008832324;DE LA VISERA, 2, 02560;LOS SANTOS DE LA HUMOSA, ESPAÑA
PROM. Y OBRAS SATER, S.L.;;;000540769;AVDA. CASTILLA LA MANCHA, 87  1º, 01247;ILLESCAS, ESPAÑA
PROMALOP, S.L.;;;001268990;SILICIO, 1  POL. IND. P 29, 02207;COLLADO VILLALBA, ESPAÑA
PROMITRANS, S.L.;;;005607626;ORENSE, 8 1º  PLANTA, 00936;MADRID, ESPAÑA
PROMLLACHAN, S.L.;;;001030232;FERRAN EL CATOLIC, Nº 1 BAJO, 03041;ALCACER, ESPAÑA
PROMOBAR INSTALACIONES, S.L.;;;000000000;DE ROMA, 43 POST., 01766;COSLADA, ESPAÑA
PROMOCION, CONST. Y MANT. INTEGRAL, S.A.;;;004777747;CARLOS MARTIN ALVAREZ, 21-LOCAL 4, 01678;MADRID, ESPAÑA
PROMOCIÓN, GESTIÓN Y MARKETING INMOBILIARIO, S.L.;;;000000000;HERNÁN CORTÉS, 5, 03010;CACERES, ESPAÑA
PROMOCIONES ARANGUIZ, S.A.U.;;aranguiz@aranguiz.info;000228288;PINTOR TEODORO DOUBLANG, 5 BAJO, 02861;VITORIA, ESPAÑA
PROMOCIONES CASCOS, S.A.;;;005195648;LIBERTAD, 21  1ºB, 02356;GIJON, ESPAÑA
PROMOCIONES EVAN TRES, S.L.;;;000000000;ARROYO DE LA POZA, NAVE 17, 01670;VALDETORRES DEL JARAMA, ESPAÑA
PROMOCIONES EVESMA, S.L.;;;606990453;OSIRIS, 11, 00838;HUMANES DE MADRID, ESPAÑA
PROMOCIONES HERMANOS LAHULE, S.L.;;flg@bbhouses.es;000000000;MAYOR, 1BIS, 1º B, 02936;GRIÑON, ESPAÑA
PROMOCIONES IBAIALDE 2004, S.L.;;eo@etxeonenak.com;000429521;PASEO LUGARITZ, 21 EDIF. SUKIA, 02277;DONOSTI, ESPAÑA
PROMOCIONES INMOBILIARIAS PINUR, S.L.;;;000000000;SAN ANTONIO, 18, 02987;CALZADA DE CALATRAVA, ESPAÑA
PROMOCIONES INMOBILIARIAS PROBILD, S.L.;;info@probild.es;000838877;HUESCA, 16 LOCAL 1, 02534;ALCAÑIZ, ESPAÑA
PROMOCIONES INMOBILIRIAS SERMOCA, S.A.;;;005973882;GENERAL VARELA, 1- LOCAL DCHO., 01732;MADRID, ESPAÑA
